[{
  "id": "furnished-holiday-lettings",
  "propertiesType": "FHL",
  "accountingPeriod": {
    "start": "2017-04-06",
    "end": "2018-04-05"
  },
  "accountingType": "CASH"
},
{
  "id": "other",
  "propertiesType": "OTHER",
  "accountingPeriod": {
    "start": "2017-04-06",
    "end": "2018-04-05"
  },
  "accountingType": "CASH"
}]
